{
  "protocolVersion": "1.0.0",
  "id": "00000000-0000-4000-8000-000000000001",
  "type": "interactive-project/quiz",
  "activitySchemaVersion": "0.0.1",
  "metadata": {
    "title": "Quiz activity"
  },
  "config": {
    "question": "Illustrative migration fixture",
    "answer": "A"
  },
  "extensions": {
    "org.example/unknown": {
      "keep": [
        null,
        false,
        {
          "__proto__": "ordinary data"
        }
      ]
    }
  }
}
