{
  "protocolVersion": "1.0.0",
  "id": "00000000-0000-4000-8000-000000000052",
  "type": "interactive-project/code",
  "activitySchemaVersion": "0.0.1",
  "metadata": {
    "title": "code generation fixture"
  },
  "config": {
    "source": "print(1)"
  },
  "extensions": {
    "com.example/permissions": {
      "execution": true,
      "network": true
    }
  }
}
