{
  "protocolVersion": "1.0.0",
  "id": "00000000-0000-4000-8000-000000000001",
  "type": "interactive-project/quiz",
  "activitySchemaVersion": "1.0.0",
  "metadata": {
    "title": "Quiz activity",
    "concepts": [
      "urn:concept:0",
      "urn:concept:1",
      "urn:concept:2",
      "urn:concept:3",
      "urn:concept:4",
      "urn:concept:5",
      "urn:concept:6",
      "urn:concept:7",
      "urn:concept:8",
      "urn:concept:9",
      "urn:concept:10",
      "urn:concept:11",
      "urn:concept:12",
      "urn:concept:13",
      "urn:concept:14",
      "urn:concept:15",
      "urn:concept:16",
      "urn:concept:17",
      "urn:concept:18",
      "urn:concept:19",
      "urn:concept:20",
      "urn:concept:21",
      "urn:concept:22",
      "urn:concept:23",
      "urn:concept:24",
      "urn:concept:25",
      "urn:concept:26",
      "urn:concept:27",
      "urn:concept:28",
      "urn:concept:29",
      "urn:concept:30",
      "urn:concept:31",
      "urn:concept:32",
      "urn:concept:33",
      "urn:concept:34",
      "urn:concept:35",
      "urn:concept:36",
      "urn:concept:37",
      "urn:concept:38",
      "urn:concept:39",
      "urn:concept:40",
      "urn:concept:41",
      "urn:concept:42",
      "urn:concept:43",
      "urn:concept:44",
      "urn:concept:45",
      "urn:concept:46",
      "urn:concept:47",
      "urn:concept:48",
      "urn:concept:49",
      "urn:concept:50",
      "urn:concept:51",
      "urn:concept:52",
      "urn:concept:53",
      "urn:concept:54",
      "urn:concept:55",
      "urn:concept:56",
      "urn:concept:57",
      "urn:concept:58",
      "urn:concept:59",
      "urn:concept:60",
      "urn:concept:61",
      "urn:concept:62",
      "urn:concept:63"
    ]
  },
  "config": {}
}
